Datum,Lokacija,Opis,Smrti,Strošek,INES ocena
2002,"Tihange, Belgium",,0,,2
2005,"Tihange, Belgium",,0,,2
2006,"Fleurus, Belgium",,0,,4
2008,"Fleurus, Belgium",,0,,3
2011,"Doel, Belgium",,0,,2
"December 12, 1952","CRL, Ontario, Canada",,0,See NRX accident,
"May 24, 1958","CRL, Ontario, Canada","The NRU accident. A fuel rod caught fire and broke when removed, then dispersed fission products and alpha-emitting particles in the reactor building.",0,See NRU accident.,
November 1978,"WR-1 Reactor at Pinawa, Manitoba, Canada",,0,Unknown,
"August 1, 1983","Pickering nuclear Reactor 2, Pickering, Ontario, Canada",,0,,
March 1986,"Bruce nuclear Reactor 2, Bruce County, Ontario, Canada",,0,Unknown,
"August 2, 1992","Pickering nuclear Reactor 1, Pickering, Ontario, Canada",,0,Unknown.,
"December 10, 1994","Pickering nuclear Reactor 2, Pickering, Ontario, Canada",,0,Unknown.,
"June 11, 2002","Bruce nuclear Reactor 6, Bruce B station. Bruce County, Ontario, Canada",,0,Unknown,
"December 21, 2009","Darlington nuclear station. Clarington, Ontario, Canada",,0,Unknown.,
"March 14, 2011","Pickering nuclear Plant A Pickering, Ontario, Canada",,0,Unknown.,
17 Oct 1969,"Loir-et-Cher, France","50 kg of uranium dioxide melted inside of the A1 nuclear reactor of Saint-Laurent-des-Eaux, during a refueling operation",0,Unknown (likely far less than the 13 Mar 1980 accident),4.0
25 Jul 1979,"Saclay, France","Radioactive fluids escaped into drains designed for ordinary wastes, seeping into the local watershed at the Saclay BL3 Reactor",0,5,
13 Mar 1980,"Loir-et-Cher, France","A malfunctioning cooling system fused fuel elements together at the Saint Laurent A2 reactor, melting two fuel assemblies and forcing an extended shutdown",0,22,4.0
14 Apr 1984,"Bugey, France",Electrical cables failed at the command center of the Bugey Nuclear Power Plant and forced a complete shutdown of one reactor,0,2,
21 May 1986,"Normandy, France",,0,5,
27 Dec 1999,"Blayais, France","An unexpectedly strong storm flooded the Blayais Nuclear Power Plant, forcing an emergency shutdown after injection pumps and containment safety systems failed from water damage",0,55,2.0
21 Jan 2002,"Manche, France","Control systems and safety valves failed after improper installation of condensers, forcing a two-month shutdown",0,102,
16 May 2004,"Cattenom-2, Lorraine, France",,0,12,1.0
13 Jul 2008,"Tricastin, France",) of wastewater contaminated with uranium were accidentally poured on the ground and runoff into a nearby river,0,7,1.0
9 Aug 2009,"Gravelines, France","Assembly system failed to properly eject spent fuel rods from the Gravelines Nuclear Power Plant, causing the fuel rods to jam and the defueling operation to be suspended",0,2,1.0
5 Apr 2012,"Penly, France","Fire on a primary pump of the second reactor, followed by a small radioactive leak into the containment",0,?,1.0
2017,"France, generic",20 reactors of the 1300 MW-class with seismic weaknesses on their emergency diesel generators,0,?,2.0
1975,"Greifswald, East Germany",A near core meltdown at Greifswald Nuclear Power Plant: Three out of six cooling water pumps were switched off for a failed test. A fourth pump broke down by loss of electric power and control of the reactor was lost. 10 fuel elements were slightly damaged before recovery,0,?,3
4 May 1986,"Hamm-Uentrop, Germany",Operator actions to dislodge damaged fuel elements at the Thorium high-temperature reactor released radioactivity to 4 km2 surrounding the facility,0,267,?
17 Dec 1987,"Hessen, Germany",Stop valve failed for a moment at Biblis Nuclear Power Plant; contamination of local area in the reactor building,0,13,
4 May 1987,"Kalpakkam, India","Fast Breeder Test Reactor at Kalpakkam refuelling accident that ruptures the reactor core, resulting in a two-year shutdown",0,300,
10 Sep 1989,"Tarapur, Maharashtra, India",Operators at the Tarapur Atomic Power Station find that the reactor had been leaking radioactive iodine at more than 700 times normal levels. Repairs to the reactor take more than a year,0,78,
13 May 1992,"Tarapur, Maharashtra, India",A malfunctioning tube causes the Tarapur Atomic Power Station to release 12 curies of radioactivity,0,2,
31 Mar 1993,"Bulandshahr, Uttar Pradesh, India","The Narora Atomic Power Station suffers a fire at two of its steam turbine blades, damaging the heavy water reactor and almost leading to a meltdown",0,220,
2 Feb 1995,"Kota, Rajasthan, India","The Rajasthan Atomic Power Station leaks radioactive helium and heavy water into the Rana Pratap Sagar River, necessitating a two-year shutdown for repairs",0,280,
22 Oct 2002,"Kalpakkam, India","Almost 100 kg radioactive sodium at the fast breeder reactor leaks into a purification cabin, ruining a number of valves and operating systems",0,30,
8 Jan 1975,"Mihama, Japan",,0,,
2 Nov 1978,"Fukushima No I, Japan","Japan's first criticality accident at No 3 reactor, this accident was hidden for 29 years and reported on 22 Mar 2007",0,,
2 Apr 1979,"Tokaimura, Japan",,0,,
24–28 Jan 1981,"Tsuruga, Japan",,0,,
8 Mar 1981,"Tsuruga, Japan",,0,,
31 Aug 1985,"Fukushima, Japan",,0,,
23 Jun 1986,"Tokaimura, Japan",,0,,
8 Feb 1991,"Fukui, Japan",,0,,
22 Feb 1993,"Fukushima, Japan",,1,,
December 1995,"Tsuruga, Japan",,0,,
11 March 1997,"Tokaimura, Japan",,0,,
18 Jun 1999,"Shika, Japan",,0,,2.0
30 Sept 1999,"Tokaimura, Japan",,2,,4.0
2002,"Onagawa, Japan",,0,,
9 Aug 2004,"Mihama, Japan",,5,,1.0
2006,"Fukushima No1, Japan",,0,,
16 Jul 2007,"Kashiwazaki, Japan",,0,,1.0
Dec 2009,"Hamaoka, Japan",Leakage accident of radioactive water. 34 workers were exposed to radiation,0,,
Mar 2011,"Fukushima Dai-ichi, Japan",,,"1,200 - 2,100",7.0
6 June 2017,Ibaraki Prefecture,,0,,
18 October 2011,"Karachi, Pakistan",,0,,
1957,"Mayak reprocessing plant, Ural-region","Kyshtym disaster: Explosion in a waste tank of the plant with a massive radioactive cloud, deteriorating deeply the health of the region's population",,?,6.0
1975,"Leningrad, Soviet union",Reactor 1 of the Leningrad Nuclear Power Plant suffered core damage which released radioactivity.,0,?,4.0
1992,"Saint Petersburg, Russian Federation",,0,?,2.0
1997,"Saint Petersburg, Russian Federation",,0,,
April 1998,"Saint Petersburg, Russian Federation",,,,
Autumn 2017,"Ural-region, Russian Federation",,,,
August 2019,Arkhangelsk region,,5,,
4 October 1999,"Wolsung, South Korea",,,,
October 1958,"Vinca, Serbia",6 Workers were exposed to high doses of radiation while taking out nuclear fuel rods out of the prototype nuclear reactor.,1,?,3
January 1969,"Lucens, Switzerland",Melting of a fuel element of the protoptype power reactor (6 Megawatts el.) VAK Lucens,0,?,4
May 2011,"Varberg, Sweden",,0,SEK 1.8 billion (estimated),
March 2001,"Maanshan, South Taiwan",2-hour-Station Blackout in one of the two units of Maanshan Nuclear Power Plant due to a grounding fault (Common cause failure) to the two available emergency diesel buses,0,?,3
26 Apr 1986,"Pripyat, Ukraine, USSR","Steam explosion and meltdown (see Chernobyl disaster) necessitating the evacuation of 300,000 people from the region and dispersing radioactive material across Europe (see Effects of the Chernobyl disaster)",,6700.0,7.0
October 1999,"Pripyat, Ukraine",,,,
"Spring, 1957","Windscale (now Sellafield), UK",,,,
8 Oct 1957,"Sellafield, UK",,,78,5
May 1967,"Scotland, United Kingdom",,,,
May 1977,"Dounreay, Scotland, UK",,,,
Sep 1996,"Dounreay, Scotland, UK",,,,
Feb 1998,"Sellafield, UK",,,,
9 May 2005,"Sellafield, UK","82,966 litres of radioactive liquor made up of nitric acid containing 20 metric tonnes of dissolved uranium and 160 kilograms of plutonium leaked via a fractured pipe from primary to secondary containment within the THORP nuclear fuel reprocessing plant.",0,65,
July until November and further on 2019/2020,"Sellafield, UK",,0,?,2
"November 29, 1955","Idaho Falls, Idaho, USA",Power excursion with partial core meltdown at National Reactor Testing Station's EBR-1 Experimental Breeder Reactor I,0.0,5,
"July 26, 1959","Simi Valley, California, USA",Partial core meltdown at Santa Susana Field Laboratory’s Sodium Reactor Experiment,0.0,32,
"January 3, 1961","Idaho Falls, Idaho, USA",Explosion at National Reactor Testing Station's SL-1 Stationary Low-Power Reactor Number One,3.0,22,4.0
"October 5, 1966","Monroe, Michigan, USA",Sodium cooling system malfunctions at Enrico Fermi demonstration breeder reactor causing some fuel elements to melt,0.0,19,4.0
"August 11, 1973","Palisades, Michigan, USA",Steam generator leak causes manual shutdown of pressurized water reactor,0.0,10,
"March 22, 1975","Browns Ferry, Alabama, USA","Fire burns for seven hours and damages more than 1600 control cables for one of the three nuclear reactors at Browns Ferry, disabling core cooling systems",0.0,240,3.0
"November 5, 1975","Brownsville, Nebraska, USA",Hydrogen gas explosion damages the Cooper Nuclear Station’s auxiliary building,0.0,13,
"June 10, 1977","Waterford, Connecticut, USA",Hydrogen gas explosion damages three buildings and forces shutdown of Millstone-1 Boiling Water Reactor,0.0,15,
"February 4, 1979","Surry, Virginia, USA",Surry Unit 2 shut down in response to failing tube bundles in steam generators,0.0,12,
"March 28, 1979","Middletown, Pennsylvania, USA","Loss of coolant and partial core meltdown, see Three Mile Island accident and Three Mile Island accident health effects",0.0,2400,5.0
"October 17, 1981","Buchanan, New York, USA",,0.0,,
"January 25, 1982","Rochester, New York, USA",Steam generator-leak at the Ginna Nuclear Generating Station causes extensive injection of the high pressure emergency core cooling system,0.0,?,
"March 20, 1982","Lycoming, New York, USA","Recirculation system piping fails at Nine Mile Point Unit 1, forcing two year shutdown",0.0,45,
"March 25, 1982","Buchanan, New York, USA",Damage to steam generator tubes and main generator resulting in a shut down Indian Point Energy Center Unit 3 for more than a year,0.0,56,
"June 18, 1982","Senaca, South Carolina, USA","Feedwater heat extraction line fails at Oconee 2 Pressurised Water Reactor, damaging thermal cooling system",0.0,10,
"February 12, 1983","Forked River, New Jersey, USA","Oyster Creek Nuclear Power Plant fails safety inspection, forced to shut down for repairs",0.0,32,
"February 26, 1983","Fort Pierce, Florida, USA","Damaged thermal shield and core barrel support at St Lucie Unit 1, necessitating 13-month shutdown",0.0,54,
"September 15, 1984","Athens, Alabama, USA","Safety violations, operator error, and design problems force six year outage at Browns Ferry Unit 2",0.0,110,
"March 9, 1985","Athens, Alabama, USA","Instrumentation systems malfunction during start-up, which led to suspension of operations at all three Browns Ferry Units",0.0,1830,
"April 11, 1986","Plymouth, Massachusetts, USA",Recurring equipment problems force emergency shutdown of Boston Edison's Pilgrim Nuclear Power Plant,0.0,1001,
1986,"Surry, Virginia, USA",Broken Feedwater pipe at Surry Nuclear Power Plant kills 4,4.0,?,
"March 31, 1987","Delta, Pennsylvania, USA",Peach Bottom units 2 and 3 shutdown due to cooling malfunctions and unexplained equipment problems,0.0,400,
"December 19, 1987","Lycoming, New York, USA",Malfunctions force Niagara Mohawk Power Corporation to shut down Nine Mile Point Unit 1,0.0,150,
"September 10, 1988","Surry, Virginia, USA","Refuelling cavity seal fails and destroys internal pipe system at Surry Unit 2, forcing 12-month outage",0.0,9,
"March 5, 1989","Tonopah, Arizona, USA","Atmospheric dump valves fail at Palo Verde Unit 1, leading to main transformer fire and emergency shutdown",0.0,14,
"March 17, 1989","Lusby, Maryland, USA","Inspections at Calvert Cliff Units 1 and 2 reveal cracks at pressurized heater sleeves, forcing extended shutdowns",0.0,120,
"November 17, 1991","Scriba, New York, USA",Safety and fire problems force shut down of the FitzPatrick nuclear reactor for 13 months,0.0,5,
"April 21, 1992","Southport, North Carolina, USA",NRC forces shut down of Brunswick Units 1 and 2 after emergency diesel generators fail,0.0,2,
"February 3, 1993","Bay City, Texas, USA","Auxiliary feed-water pumps fail at South Texas Project Units 1 and 2, prompting rapid shutdown of both reactors",0.0,3,
"February 27, 1993","Buchanan, New York, USA",New York Power Authority shuts down Indian Point Energy Center Unit 3 after AMSAC system fails,0.0,2,
"March 2, 1993","Soddy-Daisy, Tennessee, USA",Equipment failures and broken pipes cause shut down of Sequoyah Unit 1,0.0,3,
"December 25, 1993","Newport, Michigan, USA",Shut down of Fermi Unit 2 after main turbine experienced major failure due to improper maintenance,0.0,67,
14 January 1995,"Wiscasset, Maine, USA",Steam generator tubes unexpectedly crack at Maine Yankee nuclear reactor; shut down of the facility for a year,0.0,62,
"May 16, 1995","Salem, New Jersey, USA",Ventilation systems fail at Salem Units 1 and 2,0.0,34,
"February 20, 1996","Connecticut, USA","Leaking valve forces shutdown Millstone Nuclear Power Plant Units 1 and 2, multiple equipment failures found",0.0,254,
"September 2, 1996","Crystal River, Florida, USA",Balance-of-plant equipment malfunction forces shutdown and extensive repairs at Crystal River Unit 3,0.0,384,
"September 5, 1996","Clinton, Illinois, USA","Reactor recirculation pump fails, prompting shut down of Clinton boiling water reactor",0.0,38,
"September 20, 1996","Senaca, Illinois, USA",Service water system fails and results in closure of LaSalle Units 1 and 2 for more than 2 years,0.0,71,
"September 9, 1997","Bridgman, Michigan, USA",Ice condenser containment systems fail at Cook Units 1 and 2,0.0,11,
"May 25, 1999","Waterford, Connecticut, USA",Steam leak in feed-water heater causes manual shutdown and damage to control board annunciator at the Millstone Nuclear Power Plant,0.0,7,
"September 29, 1999","Lower Alloways Creek, New Jersey, USA","Major Freon leak at Hope Creek Nuclear Facility causes ventilation train chiller to trip, releasing toxic gas and damaging the cooling system",0.0,2,
"February 16, 2002","Oak Harbor, Ohio, USA",Severe corrosion of control rod drives in the reactor head forces 24-month outage of Davis-Besse reactor,0.0,143,
"January 15, 2003","Bridgman, Michigan, USA",A fault in the main transformer at the Donald C. Cook nuclear power plant causes a fire that damages the main generator and back-up turbines,0.0,10,
"June 16, 2005","Braidwood, Illinois, USA",Exelon's Braidwood Nuclear Generating Station leaks tritium and contaminates local water supplies,0.0,41,
"August 4, 2005","Buchanan, New York, USA",Entergy's Indian Point Energy Center Nuclear Plant leaks tritium and strontium into underground lakes from 1974 to 2005,,30,
"March 6, 2006","Erwin, Tennessee, USA","Nuclear fuel services plant spills 35 litres of highly enriched uranium, necessitating 7-month shutdown",0.0,98,
"November 21, 2009","Harrisburg, Pennsylvania, USA",,0.0,,
"January 7, 2010","Buchanan, New York, USA",,0.0,0,
"February 1, 2010","Vernon, Vermont, USA",Deteriorating underground pipes from the Vermont Yankee Nuclear Power Plant leak radioactive tritium into groundwater supplies,0.0,700,
August 2011,"Louisa county, Virginia, USA","A 5.8-earthquake in the region caused the loss of offsite power at the North Anna Nuclear Generating Station. Later in the incident, the plant lost an emergency diesel generator, leading to the activation of the so-called SBO diesel generator - an emergency situation.",0.0,?,2.0
"March 13, 2013","Russellville, Arkansas, USA",,1.0,?,
January 2014,"St. Lucie, Florida, USA",,0.0,?,
July 2016,"Michigan, USA","Massive steam leak in the turbine building of Donald C. Cook Nuclear Plant, unit 2",0.0,?,
December 2019,"Nebraska, USA",,0.0,?,
