Datum,Lokacija,Opis,Smrti,Strošek,INES ocena
August 2011,"Louisa county, Virginia, USA","A 5.8-earthquake in the region caused the loss of offsite power at the North Anna Nuclear Generating Station. Later in the incident, the plant lost an emergency diesel generator, leading to the activation of the so-called SBO diesel generator - an emergency situation.",0.0,?,2.0
"March 13, 2013","Russellville, Arkansas, USA",Temporary overhead crane collapsed at Arkansas Nuclear One's Unit 1,1.0,?,
January 2014,"St. Lucie, Florida, USA","Flooding of the auxiliary building of the St. Lucie Nuclear Power Plant, caused by lacking proper flood barriers",0.0,?,
July 2016,"Michigan, USA","Massive steam leak in the turbine building of Donald C. Cook Nuclear Plant, unit 2",0.0,?,
December 2019,"Nebraska, USA","One of the two safety related component cooling systems of Cooper Nuclear Station was unable to operate, because its service water system, that takes water from the river, was plugged with silt.",0.0,?,
